{
  "identifier": "main",
  "description": "Main window desktop permissions",
  "windows": ["main"],
  "platforms": ["windows", "macos", "linux"],
  "events": [
    "webview://download-requested",
    "webview://navigation-requested"
  ],
  "permissions": [
    "core:app|get-info",
    "core:event|emit",
    "core:os|info",
    "core:path|resolve",
    "core:window|close",
    "core:window|minimize",
    "core:window|maximize",
    "core:window|unmaximize",
    "core:window|toggle-maximize",
    "core:window|hide",
    "core:window|show",
    "core:window|focus",
    "core:window|center",
    "core:window|set-title",
    "core:window|set-size",
    "core:window|set-position",
    "core:window|set-min-size",
    "core:window|set-max-size",
    "core:window|set-always-on-top",
    "core:window|set-always-on-bottom",
    "core:window|set-shadow",
    "core:window|set-badge-count",
    "core:window|set-progress-bar",
    "core:window|set-resizable",
    "core:window|set-decorations",
    "core:window|set-fullscreen",
    "core:window|get-state",
    "core:window|list",
    "plugin:dialog|message",
    "plugin:dialog|confirm",
    "plugin:webview|navigate",
    "plugin:webview|get-state",
    "plugin:webview|list"
  ]
}