{
  "identifier": "editor",
  "description": "Editor window desktop permissions (explicitly declared, created by the main window)",
  "windows": ["editor"],
  "platforms": ["windows", "macos", "linux"],
  "events": [
    "window://moved",
    "window://resized",
    "window://focus-changed",
    "window://destroyed",
    "shell://theme-changed",
    "menu://item-clicked",
    "tray://clicked",
    "tray://menu-item-clicked",
    "notification://activated",
    "notification://dismissed",
    "webview://download-requested",
    "webview://navigation-requested",
    "webview://render-process-gone",
    "updater://status"
  ],
  "permissions": [
    "core:window|list",
    "core:window|close",
    "core:window|minimize",
    "core:window|maximize",
    "core:window|show",
    "core:window|hide",
    "core:window|focus",
    "core:window|set-title",
    "core:window|get-state",
    "plugin:webview|navigate",
    "plugin:webview|get-state",
    "plugin:webview|list",
    "plugin:menu|set-window-menu",
    "plugin:menu|update-item",
    "plugin:menu|append",
    "plugin:menu|insert",
    "plugin:menu|remove",
    "plugin:menu|remove-window-menu",
    "plugin:tray|create",
    "plugin:tray|set-menu",
    "plugin:tray|set-icon",
    "plugin:tray|set-tooltip",
    "plugin:tray|set-visible",
    "plugin:tray|remove",
    "plugin:notification|permission-state",
    "plugin:notification|request-permission",
    "plugin:notification|show",
    "plugin:notification|cancel",
    {
      "identifier": "plugin:fs|read-text-file",
      "allow": [
        { "base": "appData", "path": "documents/**" },
        { "base": "resources" }
      ]
    },
    "plugin:fs|stat",
    "plugin:fs|exists",
    {
      "identifier": "plugin:fs|read-dir",
      "allow": [
        { "base": "appData", "path": "documents/**" },
        { "base": "resources" }
      ]
    },
    "plugin:updater|check"
  ]
}